post_id,comment_id,comment_body,author,parent_id,parent_type,score,created_utc,cleaned_tokens
1ezbh2v,ljl09v6,"fuck, if only we had landed on the moon six separate times… 🙄

come on guys, this is a uniquely dumb conspiracy.",CloverAntics,t3_1ezbh2v,t3,2,2024-08-24 04:08:31,"['fuck', 'landed', 'moon', 'six', 'separate', 'time', 'come', 'guy', 'uniquely', 'dumb', 'conspiracy']"
1ezbh2v,ljjjw7y,show me a recent photo of the landing sites and i’ll believe it.,Substantial_Diver_34,t3_1ezbh2v,t3,1,2024-08-23 23:28:07,"['show', 'recent', 'photo', 'landing', 'site', 'ill', 'believe']"
1ezbh2v,ljkksbn,is there any concrete evidence that moon landing was fake?,Notserious-Muzakir,t3_1ezbh2v,t3,1,2024-08-24 02:47:06,"['concrete', 'evidence', 'moon', 'landing', 'fake']"
1ezbh2v,ljkn0mo,can't we actually see the landing sight with a powerful telescope?,6nayG,t3_1ezbh2v,t3,1,2024-08-24 02:58:44,"[""can't"", 'actually', 'see', 'landing', 'sight', 'powerful', 'telescope']"
1ezbh2v,ljlbngs,ask it about aliens,Volitious,t3_1ezbh2v,t3,1,2024-08-24 05:09:45,"['ask', 'alien']"
1ezbh2v,ljlgjwg,i believe there is often confusion when people pose this question. the possibility of the moon landing being staged can lead to a tangled web of doubt when considering other legitimate landings that have taken place secretly.,RadiantWarden,t3_1ezbh2v,t3,1,2024-08-24 05:36:33,"['believe', 'often', 'confusion', 'people', 'pose', 'question', 'possibility', 'moon', 'landing', 'staged', 'lead', 'tangled', 'web', 'doubt', 'considering', 'legitimate', 'landing', 'taken', 'place', 'secretly']"
1ezbh2v,ljlkhxj,well that’s a screenshot,Emandpee42069,t3_1ezbh2v,t3,1,2024-08-24 05:57:57,"['well', 'thats', 'screenshot']"
1ezbh2v,ljlzdkh,"tinfoil hat ai, eh?",Sitheral,t3_1ezbh2v,t3,1,2024-08-24 07:18:55,"['tinfoil', 'hat']"
1ezbh2v,ljm1u7h,this is one of those things that i yhink actually happened. what’s the point in spending that much money when it’s the same to actually go to the moon? maybe i need more info but the anti-moon argument isn’t too convincing right now.,Donald-n-Dougie,t3_1ezbh2v,t3,1,2024-08-24 07:33:03,"['one', 'thing', 'yhink', 'actually', 'happened', 'whats', 'point', 'spending', 'much', 'money', 'actually', 'moon', 'maybe', 'need', 'info', 'antimoon', 'argument', 'isnt', 'convincing', 'right']"
1ezbh2v,ljm6etv,lmao bro go talk to some children,nikkifromage,t3_1ezbh2v,t3,1,2024-08-24 08:00:26,"['lmao', 'bro', 'talk', 'child']"
1ezbh2v,ljmt19l,"we went to the moon in a ufo, not a spaceship, can't show that to the public.",zohan412,t3_1ezbh2v,t3,1,2024-08-24 10:22:18,"['went', 'moon', 'ufo', 'spaceship', ""can't"", 'show', 'public']"
1ezbh2v,ljmwy4w,i'm fine with this answer,,t3_1ezbh2v,t3,1,2024-08-24 10:48:12,"['fine', 'answer']"
1ezbh2v,ljmy7dt,where do you access this model?,Commercial-Penalty-7,t3_1ezbh2v,t3,1,2024-08-24 10:56:39,"['access', 'model']"
1ezbh2v,ljn32xx,nope.,sunflower__fields,t3_1ezbh2v,t3,1,2024-08-24 11:30:09,['nope']
1ezbh2v,ljn5xqp,"there’s pretty good explanation for a lot of those points. the flag was “fluttering” because it was still vibrating from being moved and planted. the shadows and lack of stars have the same explanation, the moon is reflective. having light around, even if reflected light, drowns out starts, even in almost non existent atmosphere. 


nasa is sketchy though. and they “lose things” a lot. and do dr photos. and there is evidence we may not have exited our atmosphere/got past the asteroid belt. i’m however more inclined to believe the hollow moon theory if i was going to believe any of it.",MoonWillow91,t3_1ezbh2v,t3,1,2024-08-24 11:50:06,"['there', 'pretty', 'good', 'explanation', 'lot', 'point', 'flag', 'fluttering', 'still', 'vibrating', 'moved', 'planted', 'shadow', 'lack', 'star', 'explanation', 'moon', 'reflective', 'light', 'around', 'even', 'reflected', 'light', 'drowns', 'start', 'even', 'almost', 'non', 'existent', 'atmosphere', 'nasa', 'sketchy', 'though', 'lose', 'thing', 'lot', 'photo', 'evidence', 'may', 'exited', 'atmospheregot', 'past', 'asteroid', 'belt', 'however', 'inclined', 'believe', 'hollow', 'moon', 'theory', 'going', 'believe']"
1ezbh2v,ljn868o,well that settles it once and for all.,fractalspace,t3_1ezbh2v,t3,1,2024-08-24 12:05:50,"['well', 'settle']"
1ezbh2v,ljn9oxd,lol,DiscoBiscuits13,t3_1ezbh2v,t3,1,2024-08-24 12:16:29,['lol']
1ezbh2v,ljnblh0,"ai is the new ""don't believe everything you read on the internet """,Embarrassed_Brick_34,t3_1ezbh2v,t3,1,2024-08-24 12:29:57,"['new', 'believe', 'everything', 'read', 'internet']"
1ezbh2v,ljndq9h,"""space is fake and gay""",INeedYourHelpFrank,t3_1ezbh2v,t3,1,2024-08-24 12:45:16,"['space', 'fake', 'gay']"
1ezbh2v,ljng8je,"bruh, go play some league",DeliciousBadger,t3_1ezbh2v,t3,1,2024-08-24 13:03:31,"['bruh', 'play', 'league']"
1ezbh2v,ljnk2mm,"i mean the first landing is debatable, but i’m pretty sure we’ve been to the moon a couple times by now.",Xyoyogod,t3_1ezbh2v,t3,1,2024-08-24 13:32:47,"['mean', 'first', 'landing', 'debatable', 'pretty', 'sure', 'weve', 'moon', 'couple', 'time']"
1ezbh2v,ljnlkgv,"humans no, anounaki yes",,t3_1ezbh2v,t3,1,2024-08-24 13:44:44,"['human', 'anounaki', 'yes']"
